{
  "schemaVersion": 1,
  "taskId": "git-regression-949bddcd3509",
  "agent": "claude-code",
  "variant": "ctxhelm_mcp",
  "status": "failure",
  "recommendedFiles": [
    {
      "path": "documentation/mcp.md",
      "pathHash": "path:f7f3f1a2702e7051",
      "observedAtMillis": 45753
    },
    {
      "path": "src/main/java/gr/uom/java/xmi/decomposition/UMLOperationBodyMapper.java",
      "pathHash": "path:a5e3c4836cffcfb7",
      "observedAtMillis": 45753
    },
    {
      "path": "src/main/java/gr/uom/java/xmi/diff/UMLModelDiff.java",
      "pathHash": "path:fd3283df97b3ab0b",
      "observedAtMillis": 45754
    },
    {
      "path": "src/main/java/gui/webdiff/dir/DirectoryDiffView.java",
      "pathHash": "path:6392c1f1191f0a06",
      "observedAtMillis": 45754
    },
    {
      "path": "src/main/java/org/refactoringminer/astDiff/actions/editscript/ExtendedChawatheScriptGenerator.java",
      "pathHash": "path:44ef4ba584e83192",
      "observedAtMillis": 45754
    },
    {
      "path": "src/main/java/org/refactoringminer/mcp/McpDiffBrowserResult.java",
      "pathHash": "path:a7bed44a64244429",
      "observedAtMillis": 45754
    },
    {
      "path": "src/main/java/org/refactoringminer/mcp/RefactoringMinerMcpService.java",
      "pathHash": "path:e67bc752f6705ba3",
      "observedAtMillis": 45754
    },
    {
      "path": "src/main/java/org/refactoringminer/mcp/WebDiffBrowserLauncher.java",
      "pathHash": "path:4ec34542cfc58ddc",
      "observedAtMillis": 45754
    },
    {
      "path": "src/main/java/org/refactoringminer/rm1/GitHistoryRefactoringMinerImpl.java",
      "pathHash": "path:e1d0578ca861a78c",
      "observedAtMillis": 45754
    },
    {
      "path": "src/main/java/org/refactoringminer/util/GitServiceImpl.java",
      "pathHash": "path:2fca1ec66bfc4fe2",
      "observedAtMillis": 45754
    },
    {
      "path": "src/test/java/org/refactoringminer/mcp/McpIntentValidatorTest.java",
      "pathHash": "path:de95223bfb6cc7b4",
      "observedAtMillis": 45754
    },
    {
      "path": "src/test/java/org/refactoringminer/mcp/McpValidationContractTest.java",
      "pathHash": "path:88e09dd1f7094acb",
      "observedAtMillis": 45754
    },
    {
      "path": "src/test/java/org/refactoringminer/mcp/RefactoringMinerMcpServerStartupTest.java",
      "pathHash": "path:c6b96996ffeb409b",
      "observedAtMillis": 45754
    },
    {
      "path": "src/test/java/org/refactoringminer/mcp/RefactoringMinerMcpServiceRepositoryTest.java",
      "pathHash": "path:1c383397332b0a4a",
      "observedAtMillis": 45754
    },
    {
      "path": "src/test/java/org/refactoringminer/mcp/RefactoringMinerMcpServiceTest.java",
      "pathHash": "path:ecb5971d9f1b9e46",
      "observedAtMillis": 45754
    },
    {
      "path": "src/test/java/org/refactoringminer/mcp/RefactoringMinerMcpToolsTest.java",
      "pathHash": "path:944f6c2020702566",
      "observedAtMillis": 45754
    },
    {
      "path": "src/test/java/org/refactoringminer/mcp/WebDiffBrowserLauncherTest.java",
      "pathHash": "path:0b90981b0ff18f39",
      "observedAtMillis": 45754
    },
    {
      "path": "src/test/java/org/refactoringminer/mcp/WorktreeChangeCollectorTest.java",
      "pathHash": "path:9a681b281ba9f3c4",
      "observedAtMillis": 45754
    },
    {
      "path": "src/test/java/org/refactoringminer/rm1/GitHistoryRefactoringMinerImplMergeCommitTest.java",
      "pathHash": "path:86f909026d875688",
      "observedAtMillis": 45754
    },
    {
      "path": "src/test/java/org/refactoringminer/test/TestStatementMappings.java",
      "pathHash": "path:e6e93941e0082fd8",
      "observedAtMillis": 45754
    }
  ],
  "filesRead": [],
  "filesEdited": [],
  "commands": [
    {
      "commandClass": "other",
      "commandHash": "cmd:5538ef9e8993006d",
      "touchedTests": [],
      "exitStatus": 0,
      "elapsedMillis": null
    },
    {
      "commandClass": "other",
      "commandHash": "cmd:2128418447ea1c90",
      "touchedTests": [],
      "exitStatus": 0,
      "elapsedMillis": null
    },
    {
      "commandClass": "test",
      "commandHash": "cmd:a7e875156d1f3f1b",
      "touchedTests": [
        "src/test/java/org/refactoringminer/mcp/RefactoringMinerMcpServiceRepositoryTest.java",
        "src/test/java/org/refactoringminer/mcp/RefactoringMinerMcpToolsTest.java"
      ],
      "exitStatus": 1,
      "elapsedMillis": 10163
    }
  ],
  "toolCallCount": 25,
  "tokenEstimate": 2715,
  "elapsedMillis": 96337,
  "timeToFirstRelevantFileMillis": null,
  "privacy": {
    "sourceFree": true,
    "rawSourceLogged": false,
    "rawPromptLogged": false,
    "rawTranscriptLogged": false,
    "rawTerminalLogged": false
  }
}