{
  "schemaVersion": 1,
  "taskId": "demo-auth-001",
  "agent": "demo-guided",
  "variant": "ctxhelm_mcp",
  "status": "success",
  "recommendedFiles": [
    {
      "path": "examples/demo-app/auth.test",
      "pathHash": "path:da7cbc26a42835ed",
      "observedAtMillis": 668
    },
    {
      "path": "examples/demo-app/auth.txt",
      "pathHash": "path:73d086281b248017",
      "observedAtMillis": 669
    }
  ],
  "filesRead": [
    {
      "path": "examples/demo-app/auth.txt",
      "pathHash": "path:73d086281b248017",
      "observedAtMillis": 20
    }
  ],
  "filesEdited": [
    {
      "path": "examples/demo-app/auth.txt",
      "pathHash": "path:73d086281b248017",
      "observedAtMillis": null
    }
  ],
  "commands": [
    {
      "commandClass": "other",
      "commandHash": "cmd:5538ef9e8993006d",
      "touchedTests": [],
      "exitStatus": 0,
      "elapsedMillis": null
    },
    {
      "commandClass": "other",
      "commandHash": "cmd:2128418447ea1c90",
      "touchedTests": [],
      "exitStatus": 0,
      "elapsedMillis": null
    },
    {
      "commandClass": "other",
      "commandHash": "cmd:4b4b762bdcf0cc0f",
      "touchedTests": [
        "examples/demo-app/auth.test"
      ],
      "exitStatus": 0,
      "elapsedMillis": 32
    }
  ],
  "toolCallCount": 10,
  "tokenEstimate": 64,
  "elapsedMillis": 1222,
  "timeToFirstRelevantFileMillis": 20,
  "privacy": {
    "sourceFree": true,
    "rawSourceLogged": false,
    "rawPromptLogged": false,
    "rawTranscriptLogged": false,
    "rawTerminalLogged": false
  }
}